ID,startMs,endMs,text
99xBw2-M3_Q,60,2580,hello from Colorado everybody Peter Zion
99xBw2-M3_Q,2580,5040,here if you have been following me then
99xBw2-M3_Q,5040,6960,you are aware that we're kind of in a
99xBw2-M3_Q,6960,9540,bit of a holding pattern in the Ukraine
99xBw2-M3_Q,9540,11040,war it's not that I don't think they
99xBw2-M3_Q,11040,12660,expect to be conflict in fact I think
99xBw2-M3_Q,12660,13980,that ukrainians are going to launch a
99xBw2-M3_Q,13980,15719,serious offensive but we're not going to
99xBw2-M3_Q,15719,19080,get our real fight until the spring when
99xBw2-M3_Q,19080,20760,the mud is gone and the Russians have
99xBw2-M3_Q,20760,22619,half a million new troops in the fight
99xBw2-M3_Q,22619,24300,and the ukrainians have done all that
99xBw2-M3_Q,24300,25619,deferred maintenance and all that
99xBw2-M3_Q,25619,27060,Russian equipment that they've captured
99xBw2-M3_Q,27060,28260,then we're going to see the two of them
99xBw2-M3_Q,28260,30060,really go at it
99xBw2-M3_Q,30060,32640,until then we're going to have this idea
99xBw2-M3_Q,32640,34079,that the ukrainians are on the front
99xBw2-M3_Q,34079,35700,foot and they are and that the Russians
99xBw2-M3_Q,35700,37079,are reacting and reacting poorly and
99xBw2-M3_Q,37079,40379,badly and they are but while all of that
99xBw2-M3_Q,40379,42600,is going on it's not like the Russians
99xBw2-M3_Q,42600,45600,don't have tools as we started to see a
99xBw2-M3_Q,45600,47040,few weeks ago and as we're going to see
99xBw2-M3_Q,47040,49079,more and more intently moving forward
99xBw2-M3_Q,49079,52020,the ukrainians have the momentum they're
99xBw2-M3_Q,52020,53700,getting more and more gear and the
99xBw2-M3_Q,53700,56039,Russians know that that's not a tide
99xBw2-M3_Q,56039,58199,that they can blunt so what they're
99xBw2-M3_Q,58199,60239,trying to do is to destroy the ability
99xBw2-M3_Q,60239,62640,of Ukraine to function at all as a
99xBw2-M3_Q,62640,64440,country by going after water and power
99xBw2-M3_Q,64440,66540,infrastructure particularly in the dead
99xBw2-M3_Q,66540,68880,of winter the logic being that if they
99xBw2-M3_Q,68880,70320,can break the ukrainian's ability to
99xBw2-M3_Q,70320,73320,have a modern society and Industry then
99xBw2-M3_Q,73320,74580,the rest of the war really doesn't
99xBw2-M3_Q,74580,76080,matter because the capacity of
99xBw2-M3_Q,76080,78420,ukrainians to fight and to resist and to
99xBw2-M3_Q,78420,80159,advance simply dissolves into nothing
99xBw2-M3_Q,80159,81720,and then the war is over and the
99xBw2-M3_Q,81720,83100,Russians just walk in and take over
99xBw2-M3_Q,83100,85439,that's the logic anyway
99xBw2-M3_Q,85439,87299,how it's going to play out real time is
99xBw2-M3_Q,87299,89580,some immense human suffering on a scale
99xBw2-M3_Q,89580,91380,we haven't seen yet and remember we've
99xBw2-M3_Q,91380,92939,already had one third of the Ukrainian
99xBw2-M3_Q,92939,95460,population uprooted and displaced or
99xBw2-M3_Q,95460,98340,become refugees so the scale is already
99xBw2-M3_Q,98340,100439,pretty big and the scale of what's
99xBw2-M3_Q,100439,102659,coming is going to be even bigger
99xBw2-M3_Q,102659,104280,several Ukrainian cities have
99xBw2-M3_Q,104280,106259,populations over a million and if you
99xBw2-M3_Q,106259,107939,remove the support infrastructure that
99xBw2-M3_Q,107939,109500,allows you to support a population over
99xBw2-M3_Q,109500,111840,a million you no longer have a million
99xBw2-M3_Q,111840,113340,people living there one way or the other
99xBw2-M3_Q,113340,115799,to that end Zion on geopolitics that's
99xBw2-M3_Q,115799,117619,the firm that's bringing you all of this
99xBw2-M3_Q,117619,119939,chooses a different charity every few
99xBw2-M3_Q,119939,121560,months right now we're going with Med
99xBw2-M3_Q,121560,123540,share specifically because of the
99xBw2-M3_Q,123540,126540,Ukrainian fund medshare provides medical
99xBw2-M3_Q,126540,128520,assistance communities who for whatever
99xBw2-M3_Q,128520,130259,reason are unable to provide it
99xBw2-M3_Q,130259,132239,themselves so not simply places that
99xBw2-M3_Q,132239,134040,need medical assistance that's a long
99xBw2-M3_Q,134040,136080,list places that are down on their luck
99xBw2-M3_Q,136080,138360,because of factors beyond their control
99xBw2-M3_Q,138360,140340,places that normally would be able to
99xBw2-M3_Q,140340,141959,provide for themselves who just need a
99xBw2-M3_Q,141959,144480,helping hand for the moment uh to that
99xBw2-M3_Q,144480,146640,end all of our sales from all of our
99xBw2-M3_Q,146640,149099,books will be going to Med share until
99xBw2-M3_Q,149099,150480,at least the end of the year and then
99xBw2-M3_Q,150480,151860,we'll of course reassess when we get to
99xBw2-M3_Q,151860,153840,January based on how the war is but to
99xBw2-M3_Q,153840,154739,give you an idea of what you're getting
99xBw2-M3_Q,154739,157260,into the first book Is Here is The
99xBw2-M3_Q,157260,159300,Accidental superpower this one's now 10
99xBw2-M3_Q,159300,161519,years old but it is the first major
99xBw2-M3_Q,161519,163739,publication that called for the
99xBw2-M3_Q,163739,166200,inevitability of a Russian assault on
99xBw2-M3_Q,166200,167940,Ukraine and the why and the how and the
99xBw2-M3_Q,167940,172200,where so solid starting point next up is
99xBw2-M3_Q,172200,175080,the absent superpower while this is
99xBw2-M3_Q,175080,178019,majority and energy book there is an
99xBw2-M3_Q,178019,181560,entire section in it called Russia's
99xBw2-M3_Q,181560,184080,Twilight War which talks about why the
99xBw2-M3_Q,184080,185099,Russians are doing what they're doing
99xBw2-M3_Q,185099,188519,right now and why Ukraine is really only
99xBw2-M3_Q,188519,190560,at the first step in a multi-step
99xBw2-M3_Q,190560,194519,military operation uh big fat section on
99xBw2-M3_Q,194519,196200,specifically what's going on now in
99xBw2-M3_Q,196200,197519,energy markets and what you should
99xBw2-M3_Q,197519,200640,expect as the Russian energy output
99xBw2-M3_Q,200640,204000,simply falls off the market altogether
99xBw2-M3_Q,204000,206580,third up get a little bit more recent
99xBw2-M3_Q,206580,207720,here this one's only three years old
99xBw2-M3_Q,207720,209459,this is just United Nations there's a
99xBw2-M3_Q,209459,211019,big fat chapter in here on Russia
99xBw2-M3_Q,211019,214260,specifically uh and explains why the
99xBw2-M3_Q,214260,216000,Russians are going to make one last
99xBw2-M3_Q,216000,218760,grand grab for Empire before the whole
99xBw2-M3_Q,218760,220739,system falls apart on them
99xBw2-M3_Q,220739,222959,and then finally most recently coming
99xBw2-M3_Q,222959,226019,out in June the end of the world is just
99xBw2-M3_Q,226019,228180,the beginning where the others are the
99xBw2-M3_Q,228180,230459,rise and fall of great Nations kind of
99xBw2-M3_Q,230459,232140,books this one's more on the economic
99xBw2-M3_Q,232140,234959,After Effects so in the aftermath of the
99xBw2-M3_Q,234959,237420,Ukraine war what happens to Global
99xBw2-M3_Q,237420,239220,energy in the aftermath of a Chinese
99xBw2-M3_Q,239220,240780,collapse what happens to Global
99xBw2-M3_Q,240780,243480,manufacturing and transport anyway all
99xBw2-M3_Q,243480,246239,sales all four books until at least the
99xBw2-M3_Q,246239,247680,end of the year I think I'm supposed to
99xBw2-M3_Q,247680,249299,say here that they all make great
99xBw2-M3_Q,249299,251519,stocking stuffers but I think it's more
99xBw2-M3_Q,251519,252900,accurate to say that these are more I
99xBw2-M3_Q,252900,254159,Told You So books if you're going to
99xBw2-M3_Q,254159,255840,give them as a gift so keep that in mind
99xBw2-M3_Q,255840,258359,there's going to be pushback okay that's
99xBw2-M3_Q,258359,260880,it for me hope everyone had a great
99xBw2-M3_Q,260880,262860,Thanksgiving and I will see you in
99xBw2-M3_Q,262860,265340,December
